Zone,TrafficScore,AQIScore,RoadScore,TransportScore,UFI,Recommendation
Zone A,32.04872646733112,25.847734573505427,46.0,0.0,28.48142423030881,
Zone B,32.586150739365515,21.86349630789219,0.0,45.45454545454546,25.318516190901075,
Zone C,33.617679629991535,27.810501598224768,100.0,100.0,55.39969725155281,"Repair roads and potholes, Increase public transport frequency"
Zone D,36.0250146570256,32.75804525886473,17.999999999999993,15.151515151515149,28.472244450253694,"Improve traffic management, Control pollution sources"
Zone E,36.57392955621455,31.08779828131484,74.00000000000001,69.6969696969697,47.65606684735999,"Improve traffic management, Control pollution sources, Repair roads and potholes, Increase public transport frequency"
